{
  "v": "ACDC10JSON00027f_",
  "d": "EPX2qjdstOPIiW2d9mCbTahsL258GBA-1mEuxKT5rmux",
  "i": "EMRlhEQK44_V5804rsRvQ99Gtf7uDpYQqZuvrw0LhV3S",
  "ri": "EKfi58Jiv-NVqr6GOrxgxzhrE5RsDaH4QNwv9rCyZCwZ",
  "s": "EKrv2S0OVc8SeKCzIAOSE-y4j5ybLOOgB69y12Lzxh6Y",
  "a": {
    "d": "EDYFdPx8lAM_6fZGnyav7LnZ7tKB4C91IwgzH2Q9HN3q",
    "u": "0AAt-NwGI1OZzj7e52Jq9JDD",
    "i": "EP4CmMn6ZTM3oTq-iI-2TQdlwdMXF6a2WFWaeQQRULsn",
    "knownAs": "Alice",
    "minutes": 10,
    "dt": "2023-03-13T16:15:07.686737+00:00",
    "biometricHashes": [
      "EDIai3Wkd-Z_4cezz9nYEcCK3KNH5saLvZoS_84JL6NU"
    ],
    "basis": "acquaintance",
    "caveats": "Loud conference; hard to hear Alice speaking."
  },
  "r": "EGhkNqT1LbfYlimCBMsorDt7PpeGKYdOdj6hKpUjrqtB"
}
